movie_id,title,genres,imdb_id,tmdb_id,year,budget,vote_count,vote_average,revenue,runtime,popularity,overview
73321,The Book of Eli,Action|Adventure|Drama,1037705,20504,2010,80000000.0,4303.0,6.7,157107755.0,118.0,24.843000000000004,"A post-apocalyptic tale, in which a lone man fights his way across America in order to protect a sacred book that holds the secrets to saving humankind."
74450,Valentine's Day,Comedy|Romance,817230,32856,2010,52000000.0,2323.0,5.9,216485654.0,125.0,16.444000000000006,"More than a dozen Angelenos navigate Valentine's Day from early morning until midnight. Three couples awake together, but each relationship will sputter. A grade-school boy wants flowers for his first true love. Two high school seniors plan first-time sex at noon. A TV sports reporter gets the assignment to find romance in LA. A star quarterback contemplates his future. Two strangers meet on a plane. Grandparents, together for years, face a crisis. An 'I Hate Valentine's Day' dinner beckons the lonely and the lied to."
74458,Shutter Island,Drama|Mystery|Thriller,1130884,11324,2010,80000000.0,16456.0,8.2,294804195.0,138.0,35.806,"World War II soldier-turned-U.S. Marshal Teddy Daniels investigates the disappearance of a patient from a hospital for the criminally insane, but his efforts are compromised by his troubling visions and also by a mysterious doctor."
74530,Percy Jackson & the Olympians: The Lightning Thief,Adventure|Fantasy,814255,32657,2010,95000000.0,5399.0,6.2,226497209.0,119.0,44.19300000000001,"Accident prone teenager, Percy discovers he's actually a demi-God, the son of Poseidon, and he is needed when Zeus' lightning is stolen. Percy must master his new found skills in order to prevent a war between the Gods that could devastate the entire world."
74688,Dear John,Drama|Romance|War,989757,22971,2010,25000000.0,3226.0,6.8,114977104.0,115.0,19.448,"While Sergeant John Tyree is home on two weeks leave from Germany, he meets Savannah after he dives into the ocean to retrieve Savannah's purse that had fallen off a pier. John eventually falls in love with Savannah, who promises to write to him until he returns from overseas."
74789,Alice in Wonderland,Adventure|Fantasy|IMAX,1014759,12155,2010,200000000.0,10598.0,6.6,1025467110.0,108.0,27.519000000000002,"Alice, an unpretentious and individual 19-year-old, is betrothed to a dunce of an English nobleman. At her engagement party, she escapes the crowd to consider whether to go through with the marriage and falls down a hole in the garden after spotting an unusual rabbit. Arriving in a strange and surreal place called 'Underland,' she finds herself in a world that resembles the nightmares she had as a child, filled with talking animals, villainous queens and knights, and frumious bandersnatches. Alice realizes that she is there for a reason – to conquer the horrific Jabberwocky and restore the rightful queen to her throne."
75341,Remember Me,Drama|Romance,1403981,23169,2010,16000000.0,2717.0,7.1,56032889.0,113.0,19.921,"Still reeling from a heartbreaking family event and his parents' subsequent divorce, Tyler Hawkins discovers a fresh lease on life when he meets Ally Craig, a gregarious beauty who witnessed her mother's death. But as the couple draws closer, the fallout from their separate tragedies jeopardizes their love."
76093,How to Train Your Dragon,Adventure|Animation|Children|Fantasy|IMAX,892769,10191,2010,165000000.0,9400.0,7.8,494878759.0,100.0,43.942,"As the son of a Viking leader on the cusp of manhood, shy Hiccup Horrendous Haddock III faces a rite of passage: he must kill a dragon to prove his warrior mettle. But after downing a feared dragon, he realizes that he no longer wants to destroy it, and instead befriends the beast – which he names Toothless – much to the chagrin of his warrior father"
76175,Clash of the Titans,Action|Adventure|Drama|Fantasy,800320,18823,2010,125000000.0,4531.0,5.8,493214993.0,106.0,30.914,"Born of a god but raised as a man, Perseus is helpless to save his family from Hades, vengeful god of the underworld. With nothing to lose, Perseus volunteers to lead a dangerous mission to defeat Hades before he can seize power from Zeus and unleash hell on earth. Battling unholy demons and fearsome beasts, Perseus and his warriors will only survive if Perseus accepts his power as a god, defies fate and creates his own destiny."
76251,Kick-Ass,Action|Comedy,1250777,23483,2010,28000000.0,8858.0,7.1,96188903.0,117.0,32.72,"Dave Lizewski is an unnoticed high school student and comic book fan who one day decides to become a super-hero, even though he has no powers, training or meaningful reason to do so."
77561,Iron Man 2,Action|Adventure|Sci-Fi|Thriller|IMAX,1228705,10138,2010,200000000.0,15008.0,6.8,623933331.0,124.0,49.62600000000001,"With the world now aware of his dual life as the armored superhero Iron Man, billionaire inventor Tony Stark faces pressure from the government, the press and the public to share his technology with the military. Unwilling to let go of his invention, Stark, with Pepper Potts and James 'Rhodey' Rhodes at his side, must forge new alliances – and confront powerful enemies."
77866,Robin Hood,Action|Adventure|Drama|Romance|War,955308,20662,2010,200000000.0,3206.0,6.4,310669540.0,140.0,24.51,"When soldier Robin happens upon the dying Robert of Loxley, he promises to return the man's sword to his family in Nottingham. There, he assumes Robert's identity; romances his widow, Marion; and draws the ire of the town's sheriff and King John's henchman, Godfrey."
78039,Blue Valentine,Drama|Romance,1120985,46705,2010,3500000.0,2133.0,6.9,16566240.0,112.0,21.131,"Dean and Cindy live a quiet life in a modest neighborhood. They appear to have the world at their feet at the outset of the relationship. However, his lack of ambition and her retreat into self-absorption cause potentially irreversible cracks in their marriage."
78105,Prince of Persia: The Sands of Time,Action|Adventure|Fantasy|Romance|IMAX,473075,9543,2010,150000000.0,4998.0,6.2,335154643.0,116.0,25.076,"A rogue prince reluctantly joins forces with a mysterious princess and together, they race against dark forces to safeguard an ancient dagger capable of releasing the Sands of Time – gift from the gods that can reverse time and allow its possessor to rule the world."
78316,Letters to Juliet,Drama|Romance,892318,37056,2010,30000000.0,2138.0,6.9,82148538.0,105.0,19.472,"An American girl on vacation in Italy finds an unanswered ""letter to Juliet"" -- one of thousands of missives left at the fictional lover's Verona courtyard, which are typically answered by a the ""secretaries of Juliet"" -- and she goes on a quest to find the lovers referenced in the letter."
78469,The A-Team,Action|Comedy|Thriller,429493,34544,2010,110000000.0,3296.0,6.3,177238796.0,119.0,24.074,"A group of Iraq War veterans goes on the run from U.S. military forces while they try to clear their names after being framed for a crime they didn't commit. Along the way, Col. Hannibal Smith, Capt. H.M. ‘Howling Mad’ Murdock , Sgt. Bosco ‘B.A.’ Baracus, and Lt. Templeton ‘Faceman’ Peck help out various people they encounter."
78499,Toy Story 3,Adventure|Animation|Children|Comedy|Fantasy|IMAX,435761,10193,2010,200000000.0,10695.0,7.8,1066969703.0,103.0,43.515,"Woody, Buzz, and the rest of Andy's toys haven't been played with in years. With Andy about to go to college, the gang find themselves accidentally left at a nefarious day care center. The toys must band together to escape and return home to Andy."
78637,Shrek Forever After,Adventure|Animation|Children|Comedy|Fantasy|IMAX,892791,10192,2010,165000000.0,4946.0,6.2,752600867.0,93.0,50.751999999999995,"A bored and domesticated Shrek pacts with deal-maker Rumpelstiltskin to get back to feeling like a real ogre again, but when he's duped and sent to a twisted version of Far Far Away—where Rumpelstiltskin is king, ogres are hunted, and he and Fiona have never met—he sets out to restore his world and reclaim his true love."
78772,The Twilight Saga: Eclipse,Fantasy|Romance|Thriller|IMAX,1325004,24021,2010,68000000.0,6336.0,6.2,698491347.0,124.0,58.581,"Bella once again finds herself surrounded by danger as Seattle is ravaged by a string of mysterious killings and a malicious vampire continues her quest for revenge. In the midst of it all, she is forced to choose between her love for Edward and her friendship with Jacob, knowing that her decision has the potential to ignite the ageless struggle between vampire and werewolf. With her graduation quickly approaching, Bella is confronted with the most important decision of her life."
78893,The Last Airbender,Action|Adventure|Fantasy,938283,10196,2010,150000000.0,2728.0,4.7,318502923.0,103.0,25.607,"The story follows the adventures of Aang, a young successor to a long line of Avatars, who must put his childhood ways aside and stop the Fire Nation from enslaving the Water, Earth and Air nations."
79057,Predators,Action|Sci-Fi|Thriller,1424381,34851,2010,40000000.0,2551.0,6.1,127233108.0,107.0,27.615,"A mercenary reluctantly leads a motley crew of warriors who soon come to realize they've been captured and deposited on an alien planet by an unknown nemesis. With the exception of a peculiar physician, they are all cold-blooded killers, convicts, death squad members... hunters who have now become the hunted."
79091,Despicable Me,Animation|Children|Comedy|Crime,1323594,20352,2010,69000000.0,11684.0,7.2,543513985.0,95.0,41.228,"Villainous Gru lives up to his reputation as a despicable, deplorable and downright unlikable guy when he hatches a plan to steal the moon from the sky. But he has a tough time staying on task after three orphans land in his care."
79132,Inception,Action|Crime|Drama|Mystery|Sci-Fi|Thriller|IMAX,1375666,27205,2010,160000000.0,27308.0,8.3,825532764.0,148.0,50.27,"Cobb, a skilled thief who commits corporate espionage by infiltrating the subconscious of his targets is offered a chance to regain his old life as payment for a task considered to be impossible: ""inception"", the implantation of another person's idea into a target's subconscious."
79134,Grown Ups,Comedy,1375670,38365,2010,80000000.0,4051.0,6.2,271430189.0,102.0,40.191,"After their high school basketball coach passes away, five good friends and former teammates reunite for a Fourth of July holiday weekend."
79139,The Sorcerer's Apprentice,Action|Adventure|Children|Comedy|Fantasy,963966,27022,2010,150000000.0,3647.0,6.0,215283742.0,109.0,27.061999999999998,"Balthazar Blake is a master sorcerer in modern-day Manhattan trying to defend the city from his arch-nemesis, Maxim Horvath. Balthazar can't do it alone, so he recruits Dave Stutler, a seemingly average guy who demonstrates hidden potential, as his reluctant protégé. The sorcerer gives his unwilling accomplice a crash course in the art and science of magic, and together, these unlikely partners work to stop the forces of darkness."
79185,Knight and Day,Action|Comedy|Romance,1013743,37834,2010,117000000.0,3062.0,6.1,261930431.0,109.0,23.36,"A fugitive couple goes on a glamorous and sometimes deadly adventure where nothing and no one – even themselves – are what they seem. Amid shifting alliances and unexpected betrayals, they race across the globe, with their survival ultimately hinging on the battle of truth vs. trust."
79224,The Karate Kid,Action|Children|Drama,1155076,38575,2010,40000000.0,4038.0,6.4,357852395.0,140.0,36.933,"Twelve-year-old Dre Parker could have been the most popular kid in Detroit, but his mother's latest career move has landed him in China. Dre immediately falls for his classmate Mei Ying but the cultural differences make such a friendship impossible. Even worse, Dre's feelings make him an enemy of the class bully, Cheng. With no friends in a strange land, Dre has nowhere to turn but maintenance man Mr. Han, who is a kung fu master. As Han teaches Dre that kung fu is not about punches and parries, but maturity and calm, Dre realizes that facing down the bullies will be the fight of his life."
79293,Salt,Action|Thriller,944835,27576,2010,110000000.0,3923.0,6.3,293329073.0,100.0,31.805999999999997,"As a CIA officer, Evelyn Salt swore an oath to duty, honor and country. Her loyalty will be tested when a defector accuses her of being a Russian spy. Salt goes on the run, using all her skills and years of experience as a covert operative to elude capture. Salt's efforts to prove her innocence only serve to cast doubt on her motives, as the hunt to uncover the truth behind her identity continues and the question remains: ""Who is Salt?"""
79592,The Other Guys,Action|Comedy,1386588,27581,2010,100000000.0,2801.0,6.3,170432927.0,107.0,22.496,"Unlike their heroic counterparts on the force, desk-bound NYPD detectives Gamble and Hoitz garner no headlines as they work day to day. When a seemingly minor case turns out to be a big deal, the two cops get the opportunity to finally prove to their comrades that they have the right stuff."
79695,The Expendables,Action|Adventure|Thriller,1320253,27578,2010,80000000.0,5563.0,6.1,274470394.0,103.0,30.691,"Barney Ross leads a band of highly skilled mercenaries including knife enthusiast Lee Christmas, a martial arts expert, heavy weapons specialist, demolitionist, and a loose-cannon sniper. When the group is commissioned by the mysterious Mr. Church to assassinate the dictator of a small South American island, Barney and Lee visit the remote locale to scout out their opposition and discover the true nature of the conflict engulfing the city."
79702,Scott Pilgrim vs. the World,Action|Comedy|Fantasy|Musical|Romance,446029,22538,2010,60000000.0,5091.0,7.4,47664559.0,112.0,31.445,"As bass guitarist for a garage-rock band, Scott Pilgrim  has never had trouble getting a girlfriend; usually, the problem is getting rid of them. But when Ramona Flowers skates into his heart, he finds she has the most troublesome baggage of all: an army of ex-boyfriends who will stop at nothing to eliminate him from her list of suitors."
80219,Machete,Action|Adventure|Comedy|Crime|Thriller,985694,23631,2010,20000000.0,2286.0,6.3,44093316.0,105.0,19.875,"After being set-up and betrayed by the man who hired him to assassinate a Texas Senator, an ex-Federale launches a brutal rampage of revenge against his former boss."
80363,Resident Evil: Afterlife,Action|Horror|Sci-Fi|Thriller|IMAX,1220634,35791,2010,60000000.0,2591.0,6.0,300228084.0,97.0,0.995,"In a world ravaged by a virus infection, turning its victims into the Undead, Alice continues on her journey to find survivors and lead them to safety. Her deadly battle with the Umbrella Corporation reaches new heights, but Alice gets some unexpected help from an old friend. A new lead that promises a safe haven from the Undead takes them to Los Angeles, but when they arrive the city is overrun by thousands of Undead - and Alice and her comrades are about to step into a deadly trap."
80463,The Social Network,Drama,1285016,37799,2010,40000000.0,8076.0,7.3,224920315.0,121.0,32.72,"On a fall night in 2003, Harvard undergrad and computer programming genius Mark Zuckerberg sits down at his computer and heatedly begins working on a new idea. In a fury of blogging and programming, what begins in his dorm room as a small site among friends soon becomes a global social network and a revolution in communication. A mere six years and 500 million friends later, Mark Zuckerberg is the youngest billionaire in history... but for this entrepreneur, success leads to both personal and legal complications."
80489,The Town,Crime|Drama|Thriller,840361,23168,2010,37000000.0,3155.0,7.2,154026136.0,125.0,26.241999999999997,"Doug MacRay is a longtime thief, who, smarter than the rest of his crew, is looking for his chance to exit the game. When a bank job leads to the group kidnapping an attractive branch manager, he takes on the role of monitoring her – but their burgeoning relationship threatens to unveil the identities of Doug and his crew to the FBI Agent who is on their case."
80549,Easy A,Comedy|Romance,1282140,37735,2010,8000000.0,5177.0,6.8,74952305.0,93.0,20.118,"Olive, an average high school student, sees her below-the-radar existence turn around overnight once she decides to use the school's gossip grapevine to advance her social standing. Now her classmates are turning against her and the school board is becoming concerned, including her favorite teacher and the distracted guidance counselor. With the support of her hilariously idiosyncratic parents and a little help from a long-time crush, Olive attempts to take on her notorious new identity and crush the rumor mill once and for all."
80860,Life As We Know It,Comedy|Romance,1055292,38408,2010,38000000.0,2292.0,6.9,105610124.0,114.0,23.906999999999996,"After a distastrous first date for caterer Holly and network sports director Messer, all they have is common is a dislike for each other and their love for their goddaughter Sophie. But when they suddenly become all Sophie has in this world, Holly and Messer must set their differences aside. Juggling careers and social calendars, they'll have to find common ground while living under the same roof."
81229,RED,Action|Comedy,1245526,39514,2010,58000000.0,4916.0,6.7,71664962.0,111.0,21.046999999999997,"When his peaceful life is threatened by a high-tech assassin, former black-ops agent, Frank Moses reassembles his old team in a last ditch effort to survive and uncover his assailants."
81537,Due Date,Comedy,1231583,41733,2010,65000000.0,3826.0,6.3,211780824.0,95.0,21.936,"Peter Highman must scramble across the US in five days to be present for the birth of his first child. He gets off to a bad start when his wallet and luggage are stolen, and put on the 'no-fly' list. Peter embarks on a terrifying journey when he accepts a ride from an actor."
81562,127 Hours,Adventure|Drama|Thriller,1542344,44115,2010,18000000.0,5461.0,7.0,35692920.0,94.0,15.505,The true story of mountain climber Aron Ralston's remarkable adventure to save himself after a fallen boulder crashes on his arm and traps him in an isolated canyon in Utah.
81564,Megamind,Action|Animation|Children|Comedy|Sci-Fi|IMAX,1001526,38055,2010,130000000.0,4629.0,6.8,321885765.0,96.0,43.736999999999995,"Bumbling supervillain Megamind finally defeats his nemesis, the superhero Metro Man. But without a hero, he loses all purpose and must find new meaning to his life."
81591,Black Swan,Drama|Thriller,947798,44214,2010,13000000.0,10336.0,7.6,329398046.0,108.0,28.858,A journey through the psyche of a young ballerina whose starring role as the duplicitous swan queen turns out to be a part for which she becomes frighteningly perfect.
81782,Unstoppable,Action|Drama|Thriller,477080,44048,2010,100000000.0,2351.0,6.5,167805466.0,98.0,24.186999999999998,"A runaway train, transporting deadly, toxic chemicals, is barreling down on Stanton, Pennsylvania,  and proves to be unstoppable until a veteran engineer and young conductor risk their lives to try and stop it with a switch engine."
81834,Harry Potter and the Deathly Hallows: Part 1,Action|Adventure|Fantasy|IMAX,926084,12444,2010,250000000.0,13449.0,7.8,954305868.0,146.0,71.633,"Harry, Ron and Hermione walk away from their last year at Hogwarts to find and destroy the remaining Horcruxes, putting an end to Voldemort's bid for immortality. But with Harry's beloved Dumbledore dead and Voldemort's unscrupulous Death Eaters on the loose, the world is more dangerous than ever."
81845,The King's Speech,Drama,1504320,45269,2010,15000000.0,6286.0,7.7,414211549.0,118.0,19.836,"The King's Speech tells the story of the man who became King George VI, the father of Queen Elizabeth II. After his brother abdicates, George ('Bertie') reluctantly assumes the throne. Plagued by a dreaded stutter and considered unfit to be king, Bertie engages the help of an unorthodox speech therapist named Lionel Logue. Through a set of unexpected techniques, and as a result of an unlikely friendship, Bertie is able to find his voice and boldly lead the country into war."
81847,Tangled,Animation|Children|Comedy|Fantasy|Musical|Romance|IMAX,398286,38757,2010,260000000.0,8021.0,7.6,592461732.0,100.0,34.869,"When the kingdom's most wanted-and most charming-bandit Flynn Rider hides out in a mysterious tower, he's taken hostage by Rapunzel, a beautiful and feisty tower-bound teen with 70 feet of magical, golden hair. Flynn's curious captor, who's looking for her ticket out of the tower where she's been locked away for years, strikes a deal with the handsome thief and the unlikely duo sets off on an action-packed escapade, complete with a super-cop horse, an over-protective chameleon and a gruff gang of pub thugs."
81932,The Fighter,Drama,964517,45317,2010,25000000.0,2968.0,7.4,93617009.0,116.0,21.025,"The Fighter, is a drama about boxer ""Irish"" Micky Ward's unlikely road to the world light welterweight title. His Rocky-like rise was shepherded by half-brother Dicky, a boxer-turned-trainer who rebounded in life after nearly being KO'd by drugs and crime."
82152,Beastly,Drama|Fantasy|Romance,1152398,38117,2011,17000000.0,2208.0,6.3,43202283.0,86.0,21.629,"A curse transforms a handsome and arrogant young man into everything he detests in this contemporary retelling of Beauty and the Beast. Wealthy Kyle Kingson has everything a teenager could want in life, but he still gets off on humiliating the weaker and less attractive. When Kyle invites his misfit classmate Kendra to an environmental rally at their school, she questions his motivations but reluctantly accepts. Later, Kyle blows Kendra off, prompting the spurned goth girl to cast a dark spell on the swaggering egotist."
82167,Love & Other Drugs,Comedy|Drama|Romance,758752,43347,2010,30000000.0,3372.0,7.0,102820008.0,112.0,30.947,"Maggie, an alluring free spirit who won't let anyone - or anything - tie her down. But she meets her match in Jamie, whose relentless and nearly infallible charm serve him well with the ladies and in the cutthroat world of pharmaceutical sales. Maggie and Jamie's evolving relationship takes them both by surprise, as they find themselves under the influence of the ultimate drug: love."
82169,The Chronicles of Narnia: The Voyage of the Dawn Treader,Adventure|Children|Fantasy,980970,10140,2010,155000000.0,4053.0,6.4,415686217.0,113.0,23.837,"This time around Edmund and Lucy Pevensie, along with their pesky cousin Eustace Scrubb find themselves swallowed into a painting and on to a fantastic Narnian ship headed for the very edges of the world."
82202,The Tourist,Drama|Thriller,1243957,37710,2010,100000000.0,3987.0,6.2,278731369.0,103.0,21.807,"American tourist Frank meets mysterious British woman Elsie on the train to Venice. Romance seems to bud, but there's more to her than meets the eye. Remake of the 2005 French film ""Anthony Zimmer"", written and directed by Jérôme Salle."
82459,True Grit,Western,1403865,44264,2010,38000000.0,3658.0,7.3,252276927.0,110.0,15.377,"Following the murder of her father by a hired hand, a 14-year-old farm girl sets out to capture the killer. To aid her, she hires the toughest U.S. Marshal she can find—a man with 'true grit'—Reuben J. 'Rooster' Cogburn."
82461,TRON: Legacy,Action|Adventure|Sci-Fi|IMAX,1104001,20526,2010,170000000.0,5212.0,6.4,400062763.0,125.0,22.160999999999998,"Sam Flynn, the tech-savvy and daring son of Kevin Flynn, investigates his father's disappearance and is pulled into The Grid. With the help of a mysterious program named Quorra, Sam quests to stop evil dictator Clu from crossing into the real world."
82852,Little Fockers,Comedy,970866,39451,2010,100000000.0,2347.0,5.6,310650585.0,98.0,17.146,"It has taken 10 years, two little Fockers with wife Pam and countless hurdles for Greg to finally get in with his tightly wound father-in-law, Jack. After the cash-strapped dad takes a job moonlighting for a drug company, Jack's suspicions about his favorite male nurse come roaring back. When Greg and Pam's entire clan descends for the twins' birthday party, Greg must prove to the skeptical Jack that he's fully capable as the man of the house."
83349,The Green Hornet,Action|Comedy|Crime|Fantasy|Thriller|IMAX,990407,40805,2011,120000000.0,2314.0,5.5,227817248.0,119.0,20.29,"Britt Reid (Seth Rogen), the heir to the largest newspaper fortune in Los Angeles, is a spoiled playboy who has been, thus far, happy to lead an aimless life. After his father (Tom Wilkinson) dies, Britt meets Kato (Jay Chou), a resourceful company employee. Realizing that they have the talent and resources to make something of their lives, Britt and Kato join forces as costumed crime-fighters to bring down the city's most-powerful criminal, Chudnofsky (Christoph Waltz)."
83613,Cowboys & Aliens,Action|Sci-Fi|Thriller|Western|IMAX,409847,49849,2011,163000000.0,3719.0,5.5,174822325.0,119.0,25.939,"A stranger stumbles into the desert town of Absolution with no memory of his past and a futuristic shackle around his wrist. With the help of mysterious beauty Ella and the iron-fisted Colonel Dolarhyde, he finds himself leading an unlikely posse of cowboys, outlaws, and Apache warriors against a common enemy from beyond this world in an epic showdown for survival."
84152,Limitless,Sci-Fi|Thriller,1219289,51876,2011,27000000.0,7742.0,7.2,161849455.0,105.0,19.918,"A paranoia-fueled action thriller about an unsuccessful writer whose life is transformed by a top-secret ""smart drug"" that allows him to use 100% of his brain and become a perfect version of himself. His enhanced abilities soon attract shadowy forces that threaten his new life in this darkly comic and provocative film."
