movie_id,title,genres,imdb_id,tmdb_id,year,budget,vote_count,vote_average,revenue,runtime,popularity,overview
111659,Maleficent,Action|Adventure|Children|IMAX,1587310,102651,2014,180000000.0,10317.0,7.1,758539785.0,97.0,46.03100000000001,"A beautiful, pure-hearted young woman, Maleficent has an idyllic life growing up in a peaceable forest kingdom, until one day when an invading army threatens the harmony of the land.  Maleficent rises to be the land's fiercest protector, but she ultimately suffers a ruthless betrayal – an act that begins to turn her heart into stone. Bent on revenge, Maleficent faces an epic battle with the invading King's successor and, as a result, places a curse upon his newborn infant Aurora. As the child grows, Maleficent realizes that Aurora holds the key to peace in the kingdom – and to Maleficent's true happiness as well."
111743,A Million Ways to Die in the West,Comedy|Western,2557490,188161,2014,40000000.0,2808.0,5.9,86410000.0,116.0,41.04,"As a cowardly farmer begins to fall for the mysterious new woman in town, he must put his new-found courage to the test when her husband, a notorious gun-slinger, announces his arrival."
111759,Edge of Tomorrow,Action|Sci-Fi|IMAX,1631867,137113,2014,178000000.0,9875.0,7.6,370541256.0,113.0,43.783,"Major Bill Cage is an officer who has never seen a day of combat when he is unceremoniously demoted and dropped into combat. Cage is killed within minutes, managing to take an alpha alien down with him. He awakens back at the beginning of the same day and is forced to fight and die again... and again - as physical contact with the alien has thrown him into a time loop."
111781,Mission: Impossible - Rogue Nation,Action|Adventure|Thriller,2381249,177677,2015,150000000.0,6253.0,7.2,682330139.0,131.0,37.313,"Ethan and team take on their most impossible mission yet—eradicating 'The Syndicate', an International and highly-skilled rogue organisation committed to destroying the IMF."
111921,The Fault in Our Stars,Drama|Romance,2582846,222935,2014,12000000.0,8864.0,7.6,307166834.0,125.0,25.432,"Despite the tumor-shrinking medical miracle that has bought her a few years, Hazel has never been anything but terminal, her final chapter inscribed upon diagnosis. But when a patient named Augustus Waters suddenly appears at Cancer Kid Support Group, Hazel's story is about to be completely rewritten."
112138,22 Jump Street,Action|Comedy|Crime,2294449,187017,2014,50000000.0,6023.0,6.9,188441614.0,112.0,24.142,"After making their way through high school (twice), big changes are in store for officers Schmidt and Jenko when they go deep undercover at a local college. But when Jenko meets a kindred spirit on the football team, and Schmidt infiltrates the bohemian art major scene, they begin to question their partnership. Now they don't have to just crack the case - they have to figure out if they can have a mature relationship. If these two overgrown adolescents can grow from freshmen into real men, college might be the best thing that ever happened to them."
112171,The Equalizer,Action|Crime|Thriller,455944,156022,2014,55000000.0,6130.0,7.2,192330738.0,132.0,43.88399999999999,"McCall believes he has put his mysterious past behind him and dedicated himself to beginning a new, quiet life. But when he meets Teri, a young girl under the control of ultra-violent Russian gangsters, he can’t stand idly by – he has to help her. Armed with hidden skills that allow him to serve vengeance against anyone who would brutalize the helpless, McCall comes out of his self-imposed retirement and finds his desire for justice reawakened. If someone has a problem, if the odds are stacked against them, if they have nowhere else to turn, McCall will help. He is The Equalizer."
112175,How to Train Your Dragon 2,Action|Adventure|Animation,1646971,82702,2014,145000000.0,6944.0,7.7,609123048.0,102.0,49.848,"The thrilling second chapter of the epic How To Train Your Dragon trilogy brings back the fantastical world of Hiccup and Toothless five years later. While Astrid, Snotlout and the rest of the gang are challenging each other to dragon races (the island's new favorite contact sport), the now inseparable pair journey through the skies, charting unmapped territories and exploring new worlds. When one of their adventures leads to the discovery of a secret ice cave that is home to hundreds of new wild dragons and the mysterious Dragon Rider, the two friends find themselves at the center of a battle to protect the peace."
112183,Birdman or (The Unexpected Virtue of Ignorance),Comedy|Drama,2562232,194662,2014,18000000.0,9796.0,7.5,103215094.0,120.0,34.273,"A fading actor best known for his portrayal of a popular superhero attempts to mount a comeback by appearing in a Broadway play. As opening night approaches, his attempts to become more altruistic, rebuild his career, and reconnect with friends and family prove more difficult than expected."
112290,Boyhood,Drama,1065073,85350,2014,4000000.0,3788.0,7.5,44349000.0,165.0,18.192,"The film tells a story of a divorced couple trying to raise their young son. The story follows the boy for twelve years, from first grade at age 6 through 12th grade at age 17-18, and examines his relationship with his parents as he grows."
112370,Transformers: Age of Extinction,Action|Adventure|Sci-Fi,2109248,91314,2014,210000000.0,5763.0,5.9,1104054072.0,165.0,49.672,"As humanity picks up the pieces, following the conclusion of ""Transformers: Dark of the Moon,"" Autobots and Decepticons have all but vanished from the face of the planet. However, a group of powerful, ingenious businessman and scientists attempt to learn from past Transformer incursions and push the boundaries of technology beyond what they can control - all while an ancient, powerful Transformer menace sets Earth in his cross-hairs."
112552,Whiplash,Drama,2582802,244786,2014,3300000.0,10206.0,8.4,13092000.0,107.0,37.751,"Under the direction of a ruthless instructor, a talented young drummer begins to pursue perfection at any cost, even his humanity."
112556,Gone Girl,Drama|Thriller,2267998,210577,2014,61000000.0,13198.0,7.9,369330363.0,149.0,37.823,"With his wife's disappearance having become the focus of an intense media circus, a man sees the spotlight turned on him when it's suspected that he may not be innocent."
112623,Dawn of the Planet of the Apes,Sci-Fi,2103281,119450,2014,170000000.0,8310.0,7.3,710644566.0,130.0,30.705,"A group of scientists in San Francisco struggle to stay alive in the aftermath of a plague that is wiping out humanity, while Caesar tries to maintain dominance over his community of intelligent apes."
112788,Sex Tape,Comedy,1956620,225886,2014,40000000.0,3223.0,5.4,126069509.0,97.0,44.57899999999999,"When Jay and Annie first got together, their romantic connection was intense – but ten years and two kids later, the flame of their love needs a spark.  To kick things up a notch, they decide – why not? – to make a video of themselves trying out every position in The Joy of Sex in one marathon three-hour session.  It seems like a great idea – until they discover that their most private video is no longer private.  With their reputations on the line, they know they’re just one click away from being laid bare to the world... but as their race to reclaim their video leads to a night they'll never forget, they'll find that their video will expose even more than they bargained for."
112804,I Origins,Drama|Sci-Fi,2884206,244267,2014,0.0,2286.0,7.6,336472.0,106.0,18.147000000000002,"I Origins follows a molecular biologist studying the evolution of the human eye.  He finds his work permeating his life after a brief encounter with an exotic young woman who slips away from him.  As his research continues years later with his lab partner, they make a stunning scientific discovery that has far reaching implications and complicates both his scientific and and spiritual beliefs.  Traveling half way around the world, he risks everything he has ever known to validate his theory."
112818,The Purge: Anarchy,Action|Horror|Thriller,2975578,238636,2014,9000000.0,4666.0,6.6,111928365.0,104.0,61.29,"One night per year, the government sanctions a 12-hour period in which citizens can commit any crime they wish -- including murder -- without fear of punishment or imprisonment. Leo, a sergeant who lost his son, plans a vigilante mission of revenge during the mayhem. However, instead of a death-dealing avenger, he becomes the unexpected protector of four innocent strangers who desperately need his help if they are to survive the night."
112852,Guardians of the Galaxy,Action|Adventure|Sci-Fi,2015381,118340,2014,170000000.0,21264.0,7.9,772776600.0,121.0,26.186,"Light years from Earth, 26 years after being abducted, Peter Quill finds himself the prime target of a manhunt after discovering an orb wanted by Ronan the Accuser."
112897,The Expendables 3,Action|Adventure,2333784,138103,2014,90000000.0,3523.0,6.2,206172544.0,127.0,29.552,"Barney, Christmas and the rest of the team comes face-to-face with Conrad Stonebanks, who years ago co-founded The Expendables with Barney. Stonebanks subsequently became a ruthless arms trader and someone who Barney was forced to kill… or so he thought. Stonebanks, who eluded death once before, now is making it his mission to end The Expendables -- but Barney has other plans. Barney decides that he has to fight old blood with new blood, and brings in a new era of Expendables team members, recruiting individuals who are younger, faster and more tech-savvy. The latest mission becomes a clash of classic old-school style versus high-tech expertise in the Expendables’ most personal battle yet."
112911,Hercules,Action|Adventure,1267297,184315,2014,100000000.0,3045.0,5.7,244819862.0,99.0,44.207,"Fourteen hundred years ago, a tormented soul walked the earth that was neither man nor god. Hercules was the powerful son of the god king Zeus, for this he received nothing but suffering his entire life. After twelve arduous labors and the loss of his family, this dark, world-weary soul turned his back on the gods finding his only solace in bloody battle. Over the years he warmed to the company of six similar souls, their only bond being their love of fighting and presence of death. These men and woman never question where they go to fight or why or whom, just how much they will be paid. Now the King of Thrace has hired these mercenaries to train his men to become the greatest army of all time. It is time for this bunch of lost souls to finally have their eyes opened to how far they have fallen when they must train an army to become as ruthless and blood thirsty as their reputation has become."
113345,Jupiter Ascending,Action|Adventure|Sci-Fi,1617661,76757,2015,176000003.0,5197.0,5.4,183987723.0,127.0,47.588,"In a universe where human genetic material is the most precious commodity, an impoverished young Earth woman becomes the key to strategic maneuvers and internal strife within a powerful dynasty…"
113348,Teenage Mutant Ninja Turtles,Action|Adventure|Comedy,1291150,98566,2014,125000000.0,5132.0,5.9,477200000.0,101.0,65.984,The city needs heroes. Darkness has settled over New York City as Shredder and his evil Foot Clan have an iron grip on everything from the police to the politicians. The future is grim until four unlikely outcast brothers rise from the sewers and discover their destiny as Teenage Mutant Ninja Turtles. The Turtles must work with fearless reporter April and her wise-cracking cameraman Vern Fenwick to save the city and unravel Shredder's diabolical plan.
113378,The Giver,Drama|Sci-Fi,435651,227156,2014,25000000.0,3613.0,6.5,66980456.0,97.0,17.588,"In a seemingly perfect community, without war, pain, suffering, differences or choice, a young boy is chosen to learn from an elderly man about the true pain and pleasure of the ""real"" world."
113573,Sin City: A Dame to Kill For,Action|Crime|Thriller,458481,189,2014,65000000.0,2743.0,6.3,39407616.0,102.0,35.36400000000001,Some of Sin City's most hard-boiled citizens cross paths with a few of its more reviled inhabitants.
113604,If I Stay,Drama,1355630,249164,2014,11000000.0,3368.0,7.4,78874843.0,106.0,30.656999999999996,"Mia Hall, a talented young cellist, thought the most difficult decision she would ever have to make would be whether to pursue her musical dreams at prestigious Juilliard or follow her heart to be with the love of her life, Adam, a rock singer/guitarist. However, a car wreck changes everything in an instant, and now Mia's life hangs in the balance. Suspended between life and death, Mia faces a choice that will decide her future."
114180,The Maze Runner,Action|Mystery|Sci-Fi,1790864,198663,2014,34000000.0,12583.0,7.1,348319861.0,113.0,86.338,"Set in a post-apocalyptic world, young Thomas is deposited in a community of boys after his memory is erased, soon learning they're all trapped in a maze that will require him to join forces with fellow “runners” for a shot at escape."
114662,American Sniper,Action|War,2179136,190859,2014,58800000.0,9545.0,7.4,542307423.0,133.0,38.454,"U.S. Navy SEAL Chris Kyle takes his sole mission—protect his comrades—to heart and becomes one of the most lethal snipers in American history. His pinpoint accuracy not only saves countless lives but also makes him a prime target of insurgents. Despite grave danger and his struggle to be a good husband and father to his family back in the States, Kyle serves four tours of duty in Iraq. However, when he finally returns home, he finds that he cannot leave the war behind."
114713,Annabelle,Horror,3322940,250546,2014,6500000.0,4403.0,5.7,257047661.0,99.0,38.159,"John Form has found the perfect gift for his expectant wife, Mia - a beautiful, rare vintage doll in a pure white wedding dress. But Mia's delight with Annabelle doesn't last long. On one horrific night, their home is invaded by members of a satanic cult, who violently attack the couple. Spilled blood and terror are not all they leave behind. The cultists have conjured an entity so malevolent that nothing they did will compare to the sinister conduit to the damned that is now... Annabelle."
114795,Dracula Untold,Action|Drama|Fantasy,829150,49017,2014,70000000.0,4530.0,6.3,217124280.0,92.0,28.014,"Vlad Tepes is a great hero, but when he learns the Sultan is preparing for battle and needs to form an army of 1,000 boys, he vows to find a way to protect his family. Vlad turns to dark forces in order to get the power to destroy his enemies and agrees to go from hero to monster as he's turned into the mythological vampire, Dracula."
114935,Predestination,Action|Mystery|Sci-Fi|Thriller,2397535,206487,2014,5500000.0,4309.0,7.4,4824499.0,97.0,23.448,"Predestination chronicles the life of a Temporal Agent sent on an intricate series of time-travel journeys designed to prevent future killers from committing their crimes. Now, on his final assignment, the Agent must stop the one criminal that has eluded him throughout time and prevent a devastating attack in which thousands of lives will be lost."
115122,What We Do in the Shadows,Comedy|Horror,3416742,246741,2014,1600000.0,2235.0,7.6,6263224.0,86.0,18.340999999999998,Vampire housemates try to cope with the complexities of modern life and show a newly turned hipster some of the perks of being undead.
115149,John Wick,Action|Thriller,2911666,245891,2014,20000000.0,13290.0,7.3,88761661.0,101.0,37.76300000000001,Ex-hitman John Wick comes out of retirement to track down the gangsters that took everything from him.
115170,The Judge,Drama,1872194,205587,2014,50000000.0,2890.0,7.3,83719388.0,141.0,25.522,"A successful lawyer returns to his hometown for his mother's funeral only to discover that his estranged father, the town's judge, is suspected of murder."
115210,Fury,Action|Drama|War,2713180,228150,2014,68000000.0,8405.0,7.5,211817906.0,135.0,54.478,"In the last months of World War II, as the Allies make their final push in the European theatre, a battle-hardened U.S. Army sergeant named 'Wardaddy' commands a Sherman tank called 'Fury' and its five-man crew on a deadly mission behind enemy lines. Outnumbered and outgunned, Wardaddy and his men face overwhelming odds in their heroic attempts to strike at the heart of Nazi Germany."
115569,Nightcrawler,Crime|Drama|Thriller,2872718,242582,2014,8500000.0,7382.0,7.7,50300000.0,118.0,30.714000000000002,"When Lou Bloom, desperate for work, muscles into the world of L.A. crime journalism, he blurs the line between observer and participant to become the star of his own story. Aiding him in his effort is Nina, a TV-news veteran."
115617,Big Hero 6,Action|Animation|Comedy,2245084,177572,2014,165000000.0,12123.0,7.8,657827828.0,102.0,88.664,"The special bond that develops between plus-sized inflatable robot Baymax, and prodigy Hiro Hamada, who team up with a group of friends to form a band of high-tech heroes."
115667,"Love, Rosie",Comedy|Romance,1638002,200727,2014,0.0,4644.0,7.8,4439431.0,102.0,33.775999999999996,"Since the moment they met at age 5, Rosie and Alex have been best friends, facing the highs and lows of growing up side by side. A fleeting shared moment, one missed opportunity, and the decisions that follow send their lives in completely different directions. As each navigates the complexities of life, love, and everything in between, they always find their way back to each other - but is it just friendship, or something more?  Based on Cecelia Ahern's bestselling novel, LOVE, ROSIE is a heart-warming, modern comedy-of-errors posing the ultimate question: do we really only get one shot at true love?"
115713,Ex Machina,Drama|Sci-Fi|Thriller,470752,264660,2015,15000000.0,9586.0,7.6,36869414.0,108.0,29.164,"Caleb, a 26 year old coder at the world's largest internet company, wins a competition to spend a week at a private mountain retreat belonging to Nathan, the reclusive CEO of the company. But when Caleb arrives at the remote location he finds that he will have to participate in a strange and fascinating experiment in which he must interact with the world's first true artificial intelligence, housed in the body of a beautiful robot girl."
116797,The Imitation Game,Drama|Thriller|War,2084970,205596,2014,14000000.0,12640.0,8.0,233555708.0,113.0,41.347,"Based on the real life story of legendary cryptanalyst Alan Turing, the film portrays the nail-biting race against time by Turing and his brilliant team of code-breakers at Britain's top-secret Government Code and Cypher School at Bletchley Park, during the darkest days of World War II."
116823,The Hunger Games: Mockingjay - Part 1,Adventure|Sci-Fi|Thriller,1951265,131631,2014,125000000.0,11940.0,6.8,752100229.0,123.0,59.75100000000001,Katniss Everdeen reluctantly becomes the symbol of a mass rebellion against the autocratic Capitol.
116887,Exodus: Gods and Kings,Action|Adventure|Drama,1528100,147441,2014,140000000.0,3444.0,5.8,268031828.0,150.0,65.062,"The defiant leader Moses rises up against the Egyptian Pharaoh Ramses, setting 400,000 slaves on a monumental journey of escape from Egypt and its terrifying cycle of deadly plagues."
116977,Dumb and Dumber To,Comedy,2096672,100042,2014,40000000.0,2281.0,5.5,169837010.0,110.0,32.592,"20 years since their first adventure, Lloyd and Harry go on a road trip to find Harry's newly discovered daughter, who was given up for adoption."
117176,The Theory of Everything,Drama|Romance,2980516,266856,2014,15000000.0,8016.0,7.9,123726688.0,123.0,24.291999999999998,"The Theory of Everything is the extraordinary story of one of the world’s greatest living minds, the renowned astrophysicist Stephen Hawking, who falls deeply in love with fellow Cambridge student Jane Wilde."
117466,In the Heart of the Sea,Action|Adventure|Drama,1390411,205775,2015,100000000.0,2809.0,6.7,93920758.0,122.0,22.365,"In the winter of 1820, the New England whaling ship Essex is assaulted by something no one could believe—a whale of mammoth size and will, and an almost human sense of vengeance."
117529,Jurassic World,Action|Adventure|Drama|Sci-Fi|Thriller,369610,135397,2015,150000000.0,16073.0,6.6,1671713208.0,124.0,89.256,"Twenty-two years after the events of Jurassic Park, Isla Nublar now features a fully functioning dinosaur theme park, Jurassic World, as originally envisioned by John Hammond."
117590,Horrible Bosses 2,Comedy|Crime,2170439,227159,2014,42000000.0,3095.0,6.2,107670357.0,108.0,34.165,"Dale, Kurt and Nick decide to start their own business but things don't go as planned because of a slick investor, prompting the trio to pull off a harebrained and misguided kidnapping scheme."
117851,Penguins of Madagascar,Adventure|Animation|Children|Comedy,1911658,270946,2014,132000000.0,2912.0,6.5,373552094.0,92.0,70.07600000000001,"Skipper, Kowalski, Rico and Private join forces with undercover organization The North Wind to stop the villainous Dr. Octavius Brine from destroying the world as we know it."
117881,Still Alice,Drama,3316960,284293,2014,5000000.0,2312.0,7.5,43884652.0,101.0,15.770999999999999,"Alice Howland, happily married with three grown children, is a renowned linguistics professor who starts to forget words. When she receives a devastating diagnosis, Alice and her family find their bonds tested."
117887,Paddington,Children|Comedy,1109624,116149,2014,55000000.0,2380.0,7.1,259207227.0,96.0,22.43,"A young Peruvian bear travels to London in search of a new home. Finding himself lost and alone at Paddington Station, he meets the kindly Brown family."
117895,Maze Runner: The Scorch Trials,Action|Thriller,4046784,294254,2015,61000000.0,7530.0,6.7,312296056.0,132.0,49.31,"Thomas and his fellow Gladers face their greatest challenge yet: searching for clues about the mysterious and powerful organization known as WCKD. Their journey takes them to the Scorch, a desolate landscape filled with unimaginable obstacles. Teaming up with resistance fighters, the Gladers take on WCKD’s vastly superior forces and uncover its shocking plans for them all."
118696,The Hobbit: The Battle of the Five Armies,Adventure|Fantasy,2310332,122917,2014,250000000.0,10271.0,7.3,956019788.0,144.0,94.84,"Immediately after the events of The Desolation of Smaug, Bilbo and the dwarves try to defend Erebor's mountain of treasure from others who claim it: the men of the ruined Laketown and the elves of Mirkwood. Meanwhile an army of Orcs led by Azog the Defiler is marching on Erebor, fueled by the rise of the dark lord Sauron. Dwarves, elves and men must unite, and the hope for Middle-Earth falls into Bilbo's hands."
118702,Unbroken,Drama|War,1809398,227306,2014,65000000.0,2914.0,7.5,163442937.0,137.0,24.234,"A chronicle of the life of Louis Zamperini, an Olympic runner who was taken prisoner by Japanese forces during World War II."
118985,Big Eyes,Drama,1126590,87093,2014,10000000.0,2658.0,7.0,28883511.0,105.0,15.860999999999999,"The story of the awakening of painter, Margaret Keane, her phenomenal success in the 1950s, and the subsequent legal difficulties she had with her husband, who claimed credit for her works in the 1960s."
118997,Into the Woods,Children|Comedy|Fantasy|Musical,2180411,224141,2014,50000000.0,3447.0,5.8,212902372.0,125.0,21.712,"In a woods filled with magic and fairy tale characters, a baker and his wife set out to end the curse put on them by their neighbor, a spiteful witch."
119141,The Interview,Action|Comedy,2788710,228967,2014,44000000.0,4291.0,6.2,12342632.0,112.0,23.43,"Dave Skylark and his producer Aaron Rapaport run the celebrity tabloid show ""Skylark Tonight"". When they land an interview with a surprise fan, North Korean dictator Kim Jong-un, they are recruited by the CIA to turn their trip to Pyongyang into an assassination mission."
119145,Kingsman: The Secret Service,Action|Adventure|Comedy|Crime,2802144,207703,2015,81000000.0,12259.0,7.6,414351546.0,129.0,38.806,The story of a super-secret spy organization that recruits an unrefined but promising street kid into the agency's ultra-competitive training program just as a global threat emerges from a twisted tech genius.
119155,Night at the Museum: Secret of the Tomb,Adventure|Children|Comedy|Fantasy,2692250,181533,2014,127000000.0,4374.0,6.2,363204635.0,97.0,37.171,"When the magic powers of The Tablet of Ahkmenrah begin to die out, Larry Daley spans the globe, uniting favorite and new characters while embarking on an epic quest to save the magic before it is gone forever."
120466,Chappie,Action|Thriller,1823672,198184,2015,49000000.0,5933.0,6.8,104399548.0,120.0,59.106,"Every child comes into the world full of promise, and none more so than Chappie: he is gifted, special, a prodigy. Like any child, Chappie will come under the influence of his surroundings—some good, some bad—and he will rely on his heart and soul to find his way in the world and become his own man. But there's one thing that makes Chappie different from any one else: he is a robot."
120635,Taken 3,Action|Crime|Thriller,2446042,260346,2015,48000000.0,4141.0,6.2,325771424.0,109.0,67.51,"Ex-government operative Bryan Mills finds his life is shattered when he's falsely accused of a murder that hits close to home. As he's pursued by a savvy police inspector, Mills employs his particular set of skills to track the real killer and exact his unique brand of justice."
120799,Terminator Genisys,Action|Adventure|Sci-Fi|Thriller,1340138,87101,2015,155000000.0,6311.0,5.9,440603537.0,126.0,62.856,"The year is 2029. John Connor, leader of the resistance continues the war against the machines. At the Los Angeles offensive, John's fears of the unknown future begin to emerge when TECOM spies reveal a new plot by SkyNet that will attack him from both fronts; past and future, and will ultimately change warfare forever."
