movie_id,title,genres,imdb_id,tmdb_id,year,budget,vote_count,vote_average,revenue,runtime,popularity,overview
162322,Mechanic: Resurrection,Action|Crime|Thriller,3522806,278924,2016,40000000.0,2342.0,5.8,125729635.0,99.0,39.5,"Arthur Bishop thought he had put his murderous past behind him when his most formidable foe kidnaps the love of his life. Now he is forced to travel the globe to complete three impossible assassinations, and do what he does best, make them look like accidents."
162350,The Magnificent Seven,Action|Western,2404435,333484,2016,90000000.0,4307.0,6.3,162360636.0,132.0,28.583000000000002,"Looking to mine for gold, greedy industrialist Bartholomew Bogue seizes control of the Old West town of Rose Creek. With their lives in jeopardy, Emma Cullen and other desperate residents turn to bounty hunter Sam Chisolm for help. Chisolm recruits an eclectic group of gunslingers to take on Bogue and his ruthless henchmen. With a deadly showdown on the horizon, the seven mercenaries soon find themselves fighting for more than just money once the bullets start to fly."
162578,Kubo and the Two Strings,Adventure|Animation|Children|Fantasy,4302938,313297,2016,60000000.0,2586.0,7.7,69929545.0,102.0,31.59,"Kubo mesmerizes the people in his village with his magical gift for spinning wild tales with origami. When he accidentally summons an evil spirit seeking vengeance, Kubo is forced to go on a quest to solve the mystery of his fallen samurai father and his mystical weaponry, as well as discover his own magical powers."
162590,Bridget Jones's Baby,Comedy|Romance,1473832,95610,2016,35000000.0,2225.0,6.4,211952420.0,123.0,13.974,"Breaking up with Mark Darcy leaves Bridget Jones over 40 and single again. Feeling that she has everything under control, Jones decides to focus on her career as a top news producer. Suddenly, her love life comes back from the dead when she meets a dashing and handsome American named Jack. Things couldn't be better, until Bridget discovers that she is pregnant. Now, the befuddled mom-to-be must figure out if the proud papa is Mark or Jack."
162598,Deepwater Horizon,Drama,1860357,296524,2016,110000000.0,3194.0,6.8,121790373.0,107.0,24.941999999999997,"A story set on the offshore drilling rig Deepwater Horizon, which exploded during April 2010 and created the worst oil spill in U.S. history."
162600,Miss Peregrine's Home for Peculiar Children,Fantasy,1935859,283366,2016,110000000.0,7348.0,6.7,296482446.0,127.0,53.4,A teenager finds himself transported to an island where he must help protect a group of orphans with special powers from creatures intent on destroying them.
162602,The Girl on the Train,Thriller,3631112,346685,2016,45000000.0,4335.0,6.4,173185859.0,112.0,16.195,"Rachel Watson, devastated by her recent divorce, spends her daily commute fantasizing about the seemingly perfect couple who live in a house that her train passes every day, until one morning she sees something shocking happen there and becomes entangled in the mystery that unfolds."
162606,The Accountant,Crime|Drama|Thriller,2140479,302946,2016,44000000.0,4127.0,7.0,155160045.0,128.0,31.158,"As a math savant uncooks the books for a new client, the Treasury Department closes in on his activities and the body count starts to rise."
163134,Your Name.,Animation|Drama|Fantasy|Romance,5311514,372058,2016,0.0,6431.0,8.6,357986087.0,106.0,102.76799999999999,"High schoolers Mitsuha and Taki are complete strangers living separate lives. But one night, they suddenly switch places. Mitsuha wakes up in Taki’s body, and he in hers. This bizarre occurrence continues to happen randomly, and the two must adjust their lives around each other."
163645,Hacksaw Ridge,Drama|War,2119532,324786,2016,40000000.0,8684.0,8.1,175302354.0,139.0,98.773,"WWII American Army Medic Desmond T. Doss, who served during the Battle of Okinawa, refuses to kill people and becomes the first Conscientious Objector in American history to receive the Congressional Medal of Honor."
164175,A Monster Calls,Drama|Fantasy,3416532,258230,2016,43000000.0,2369.0,7.2,47309313.0,108.0,17.317999999999998,A boy imagines a monster that helps him deal with his difficult life and see the world in a different way.
164179,Arrival,Sci-Fi,2543164,329865,2016,47000000.0,12833.0,7.5,203388186.0,116.0,39.536,"Taking place after alien crafts land around the world, an expert linguist is recruited by the military to determine whether they come in peace or are a threat."
164909,La La Land,Comedy|Drama|Romance,3783958,313369,2016,30000000.0,12417.0,7.9,446486224.0,129.0,24.939,"Mia, an aspiring actress, serves lattes to movie stars in between auditions and Sebastian, a jazz musician, scrapes by playing cocktail party gigs in dingy bars, but as success mounts they are faced with decisions that begin to fray the fragile fabric of their love affair, and the dreams they worked so hard to maintain in each other threaten to rip them apart."
164981,Allied,Action|Drama|Romance|Thriller|War,3640424,369885,2016,85000000.0,3357.0,6.7,119520023.0,124.0,28.108,"In 1942, an intelligence officer in North Africa encounters a female French Resistance fighter on a deadly mission behind enemy lines. When they reunite in London, their relationship is tested by the pressures of war."
165101,Inferno,Mystery|Thriller,3062096,207932,2016,75000000.0,4717.0,6.0,220021259.0,121.0,22.01,"After waking up in a hospital with amnesia, professor Robert Langdon and a doctor must race against time to foil a deadly global plot."
165141,Trolls,Adventure|Animation|Children,1679335,136799,2016,125000000.0,2611.0,6.7,346864462.0,92.0,53.86,"Lovable and friendly, the trolls love to play around. But one day, a mysterious giant shows up to end the party. Poppy, the optimistic leader of the Trolls, and her polar opposite, Branch, must embark on an adventure that takes them far beyond the only world they’ve ever known."
165347,Jack Reacher: Never Go Back,Action|Crime|Drama|Mystery|Thriller,3393786,343611,2016,60000000.0,3323.0,5.7,162146076.0,118.0,34.551,"Jack Reacher must uncover the truth behind a major government conspiracy in order to clear his name. On the run as a fugitive from the law, Reacher uncovers a potential secret from his past that could change his life forever."
165549,Manchester by the Sea,Drama,4034228,334541,2016,9000000.0,4118.0,7.5,78988148.0,138.0,21.039,"After his older brother passes away, Lee Chandler is forced to return home to care for his 16-year-old nephew. There he is compelled to deal with a tragic past that separated him from his family and the community where he was born and raised."
165551,Lion,Drama,3741834,334543,2016,12000000.0,5000.0,8.1,140312928.0,118.0,25.180999999999997,"A five-year-old Indian boy gets lost on the streets of Calcutta, thousands of kilometers from home. He survives many challenges before being adopted by a couple in Australia; 25 years later, he sets out to find his lost family."
165603,The Autopsy of Jane Doe,Horror,3289956,397243,2016,0.0,2659.0,6.6,5972942.0,86.0,29.705,"Father and son coroners receive a mysterious unidentified corpse with no apparent cause of death. As they attempt to examine the beautiful young ""Jane Doe,"" they discover increasingly bizarre clues that hold the key to her terrifying secrets."
165937,Collateral Beauty,Drama,4682786,345920,2016,36000000.0,4272.0,7.3,88528280.0,97.0,21.741999999999997,"Retreating from life after a tragedy, a man questions the universe by writing to Love, Time and Death. Receiving unexpected answers, he begins to see how these things interlock and how even loss can reveal moments of meaning and beauty."
166461,Moana,Adventure|Animation|Children|Comedy|Fantasy,3521164,277834,2016,150000000.0,8733.0,7.6,690860472.0,107.0,20.28,"In Ancient Polynesia, when a terrible curse incurred by Maui reaches an impetuous Chieftain's daughter's island, she answers the Ocean's call to seek out the demigod to set things right."
166528,Rogue One: A Star Wars Story,Action|Adventure|Fantasy|Sci-Fi,3748528,330459,2016,200000000.0,11369.0,7.5,1056057273.0,133.0,30.256999999999998,A rogue band of resistance fighters unite for a mission to steal the Death Star plans and bring a new hope to the galaxy.
166534,Split,Drama|Horror|Thriller,4972582,381288,2017,9000000.0,12926.0,7.3,278454358.0,117.0,56.773999999999994,"Though Kevin has evidenced 23 personalities to his trusted psychiatrist, Dr. Fletcher, there remains one still submerged who is set to materialize and dominate all the others. Compelled to abduct three teenage girls led by the willful, observant Casey, Kevin reaches a war for survival among all of those contained within him — as well as everyone around him — as the walls between his compartments shatter apart."
166558,Underworld: Blood Wars,Action|Horror,3717252,346672,2016,35000000.0,2722.0,5.7,81093313.0,91.0,39.365,"Vampire death dealer Selene fends off brutal attacks from both the Lycan clan and the Vampire faction that betrayed her. With her only allies, David and his father Thomas, she must stop the eternal war between Lycans and Vampires, even if it means she has to make the ultimate sacrifice."
166635,Passengers,Adventure|Drama|Romance|Sci-Fi,1355644,274870,2016,110000000.0,9746.0,6.9,303144152.0,116.0,17.552,"A spacecraft traveling to a distant colony planet and transporting thousands of people has a malfunction in its sleep chambers. As a result, two passengers are awakened 90 years early."
166643,Hidden Figures,Drama,4846340,381284,2016,25000000.0,6216.0,8.0,230698791.0,127.0,34.828,"The untold story of Katherine G. Johnson, Dorothy Vaughan and Mary Jackson – brilliant African-American women working at NASA and serving as the brains behind one of the greatest operations in history – the launch of astronaut John Glenn into orbit. The visionary trio crossed all gender and race lines to inspire generations to dream big."
166918,The Great Wall,Action|Adventure|Thriller,2034800,311324,2016,150000000.0,3538.0,5.9,331957105.0,103.0,37.150999999999996,European mercenaries searching for black powder become embroiled in the defense of the Great Wall of China against a horde of monstrous creatures.
166946,The Founder,Drama,4276820,310307,2016,25000000.0,3108.0,7.1,24121245.0,115.0,18.57,"The true story of how Ray Kroc, a salesman from Illinois, met Mac and Dick McDonald, who were running a burger operation in 1950s Southern California. Kroc was impressed by the brothers’ speedy system of making the food and saw franchise potential. He maneuvered himself into a position to be able to pull the company from the brothers and create a billion-dollar empire."
167018,Why Him?,Comedy,4501244,356305,2016,38000000.0,3080.0,6.3,118034273.0,111.0,23.171999999999997,A dad forms a bitter rivalry with his daughter's young rich boyfriend.
167036,Sing,Animation|Children|Comedy,3470600,335797,2016,75000000.0,5564.0,7.0,634151679.0,108.0,78.73,A koala named Buster recruits his best friend to help him drum up business for his theater by hosting a singing competition.
167370,Assassin's Creed,Action|Adventure|Sci-Fi,2094766,121856,2016,125000000.0,5928.0,5.4,240697856.0,115.0,25.239,"Through unlocked genetic memories that allow him to relive the adventures of his ancestor in 15th century Spain, Callum Lynch discovers he's a descendant of the secret 'Assassins' society. After gaining incredible knowledge and skills, he is now poised to take on the oppressive Knights Templar in the present day."
167380,A Dog's Purpose,Comedy|Drama,1753383,381289,2017,22000000.0,2220.0,7.5,194647323.0,100.0,33.08,A dog goes on quest to discover his purpose in life over the course of several lifetimes with multiple owners.
167640,A Cure for Wellness,Drama|Horror|Mystery|Thriller,4731136,340837,2017,40000000.0,2717.0,6.3,26559557.0,146.0,26.43,"An ambitious young executive is sent to retrieve his company's CEO from an idyllic but mysterious ""wellness center"" at a remote location in the Swiss Alps but soon suspects that the spa's miraculous treatments are not what they seem."
167738,xXx: Return of Xander Cage,Action|Adventure|Crime|Thriller,1293847,47971,2017,85000000.0,3131.0,5.7,346147658.0,107.0,45.128,"Extreme athlete turned government operative Xander Cage comes out of self-imposed exile, thought to be long dead, and is set on a collision course with deadly alpha warrior Xiang and his team in a race to recover a sinister and seemingly unstoppable weapon known as Pandora's Box. Recruiting an all-new group of thrill-seeking cohorts, Xander finds himself enmeshed in a deadly conspiracy that points to collusion at the highest levels of world governments."
167746,The Lego Batman Movie,Action|Animation|Comedy,4116284,324849,2017,80000000.0,3517.0,7.2,311950384.0,104.0,24.354,"In the irreverent spirit of fun that made ""The Lego Movie"" a worldwide phenomenon, the self-described leading man of that ensemble—Lego Batman—stars in his own big-screen adventure. But there are big changes brewing in Gotham, and if he wants to save the city from The Joker’s hostile takeover, Batman may have to drop the lone vigilante thing, try to work with others and maybe, just maybe, learn to lighten up."
167832,The Invisible Guest,Thriller,4857264,411088,2016,4000000.0,2715.0,8.2,30000000.0,106.0,35.347,"A young businessman wakes up in a hotel room, locked from the inside, along with his lover, who was murdered while he was unconscious. He hires a prestigious lawyer, and over the course of one evening, they must work together to build a defense case for him before he is taken to jail."
168248,John Wick: Chapter 2,Action|Crime|Thriller,4425200,324552,2017,40000000.0,8312.0,7.2,171539887.0,122.0,68.80199999999999,"John Wick is forced out of retirement by a former associate looking to seize control of a shadowy international assassins’ guild. Bound by a blood oath to aid him, Wick travels to Rome and does battle against some of the world’s most dangerous killers."
168250,Get Out,Horror,5052448,419430,2017,4500000.0,11786.0,7.6,255407969.0,104.0,34.928000000000004,"Chris and his girlfriend Rose go upstate to visit her parents for the weekend. At first, Chris reads the family's overly accommodating behavior as nervous attempts to deal with their daughter's interracial relationship, but as the weekend progresses, a series of increasingly disturbing discoveries lead him to a truth that he never could have imagined."
168252,Logan,Action|Sci-Fi,3315342,263115,2017,97000000.0,14843.0,7.8,619021436.0,137.0,67.482,"In the near future, a weary Logan cares for an ailing Professor X in a hideout on the Mexican border. But Logan's attempts to hide from the world and his legacy are upended when a young mutant arrives, pursued by dark forces."
168254,Kong: Skull Island,Action|Adventure|Fantasy,3731562,293167,2017,185000000.0,7484.0,6.4,566652812.0,118.0,57.908,"Explore the mysterious and dangerous home of the king of the apes as a team of explorers ventures deep inside the treacherous, primordial island."
168266,T2 Trainspotting,Crime|Drama,2763304,180863,2017,18000000.0,2218.0,6.9,42067430.0,117.0,17.622,"After 20 years abroad, Mark Renton returns to Scotland and reunites with his old friends Sick Boy, Spud and Begbie."
168286,Before I Fall,Drama,1691916,397837,2017,5000000.0,2755.0,7.0,12141122.0,98.0,16.419,"Samantha Kingston has everything. Then, everything changes. After one fateful night, she wakes up with no future at all. Trapped into reliving the same day over and over, she begins to question just how perfect her life really was."
168344,King Arthur: Legend of the Sword,Action|Adventure|Drama|Fantasy,1972591,274857,2017,175000000.0,4182.0,6.5,148675066.0,126.0,27.779,"When the child Arthur’s father is murdered, Vortigern, Arthur’s uncle, seizes the crown. Robbed of his birthright and with no idea who he truly is, Arthur comes up the hard way in the back alleys of the city. But once he pulls the sword Excalibur from the stone, his life is turned upside down and he is forced to acknowledge his true legacy... whether he likes it or not."
168366,Beauty and the Beast,Fantasy|Romance,2771200,321612,2017,160000000.0,12845.0,7.0,1263521126.0,129.0,49.897,A live-action adaptation of Disney's version of the classic tale of a cursed prince and a beautiful young woman who helps him break the spell.
168418,The Boss Baby,Animation|Children|Comedy,3874544,295693,2017,125000000.0,5383.0,6.4,498814908.0,97.0,34.498000000000005,"A story about how a new baby's arrival impacts a family, told from the point of view of a delightfully unreliable narrator, a wildly imaginative 7 year old named Tim."
168492,Call Me by Your Name,Drama|Romance,5726616,398818,2017,4000000.0,7964.0,8.3,41063475.0,132.0,56.417,"In 1980s Italy, a relationship begins between seventeen-year-old teenage Elio and the older adult man hired as his father's research assistant."
168612,Ghost in the Shell,Action|Drama|Sci-Fi,1219827,315837,2017,110000000.0,6109.0,6.0,169801921.0,107.0,47.007,"In the near future, Major is the first of her kind: a human saved from a terrible crash, then cyber-enhanced to be a perfect soldier devoted to stopping the world's most dangerous criminals."
168712,Fifty Shades Darker,Drama|Romance,4465564,341174,2017,55000000.0,5781.0,6.4,378827494.0,118.0,30.975,"When a wounded Christian Grey tries to entice a cautious Ana Steele back into his life, she demands a new arrangement before she will give him another chance. As the two begin to build trust and find stability, shadowy figures from Christian’s past start to circle the couple, determined to destroy their hopes for a future together."
169864,Life,Horror|Sci-Fi|Thriller,5442430,395992,2017,58000000.0,5276.0,6.4,100541806.0,103.0,30.318,"The six-member crew of the International Space Station is tasked with studying a sample from Mars that may be the first proof of extra-terrestrial life, which proves more intelligent than ever expected."
169948,Two Is a Family,Comedy|Drama,5078204,382591,2016,0.0,2364.0,7.8,1447740.0,118.0,15.142999999999999,A man without attachments or responsibilities suddenly finds himself with an abandoned baby and leaves for London to try and find the mother. Eight years later after he and his daughter become inseparable Gloria's mother reappears.
169982,Power Rangers,Action|Adventure|Sci-Fi,3717490,305470,2017,100000000.0,3312.0,6.2,142337240.0,124.0,51.48,"Saban's Power Rangers follows five ordinary teens who must become something extraordinary when they learn that their small town of Angel Grove — and the world — is on the verge of being obliterated by an alien threat. Chosen by destiny, our heroes quickly discover they are the only ones who can save the planet. But to do so, they will have to overcome their real-life issues and before it’s too late, band together as the Power Rangers."
169984,Alien: Covenant,Action|Horror|Sci-Fi|Thriller,2316204,126889,2017,97000000.0,5981.0,6.0,232380243.0,122.0,57.633,"Bound for a remote planet on the far side of the galaxy, the crew of the colony ship 'Covenant' discovers what is thought to be an uncharted paradise, but is actually a dark, dangerous world—which has a sole inhabitant: the 'synthetic', David, survivor of the doomed Prometheus expedition."
170697,Gifted,Drama,4481414,400928,2017,7000000.0,3342.0,8.0,40343446.0,101.0,39.134,"Frank, a single man raising his child prodigy niece Mary, is drawn into a custody battle with his mother."
170787,"Everything, Everything",Drama|Romance,5001718,417678,2017,10000000.0,3129.0,7.2,61621140.0,96.0,25.338,"A teenager who's lived a sheltered life because she's allergic to everything, falls for the boy who moves in next door."
170813,Baywatch,Action|Comedy,1469304,339846,2017,69000000.0,5973.0,6.1,177856751.0,116.0,66.818,"Devoted lifeguard Mitch Buchannon butts heads with a brash new recruit. Together, they uncover a local criminal plot that threatens the future of the Bay."
170827,The Mummy,Action|Adventure|Fantasy|Horror|Thriller,2345759,282035,2017,125000000.0,5402.0,5.5,409231607.0,110.0,30.24,"Though safely entombed in a crypt deep beneath the unforgiving desert, an ancient queen whose destiny was unjustly taken from her is awakened in our current day, bringing with her malevolence grown over millennia, and terrors that defy human comprehension."
170875,The Fate of the Furious,Action|Crime|Drama|Thriller,4630562,337339,2017,250000000.0,7660.0,6.9,1238764765.0,136.0,71.381,"When a mysterious woman seduces Dom into the world of crime and a betrayal of those closest to him, the crew face trials that will test them as never before."
170957,Cars 3,Adventure|Animation|Comedy,3606752,260514,2017,175000000.0,3582.0,6.8,383925276.0,102.0,72.137,"Blindsided by a new generation of blazing-fast racers, the legendary Lightning McQueen is suddenly pushed out of the sport he loves. To get back in the game, he will need the help of an eager young race technician with her own plan to win, inspiration from the late Fabulous Hudson Hornet, and a few unexpected turns. Proving that #95 isn't through yet will test the heart of a champion on Piston Cup Racing’s biggest stage!"
171763,Baby Driver,Action|Crime|Thriller,3890160,339403,2017,34000000.0,10842.0,7.5,226945087.0,113.0,57.004,"After being coerced into working for a crime boss, a young getaway driver finds himself taking part in a heist doomed to fail."
172547,Despicable Me 3,Adventure|Animation|Children|Comedy,3469046,324852,2017,80000000.0,5128.0,6.4,1031552585.0,96.0,40.778,Gru and his wife Lucy must stop former '80s child star Balthazar Bratt from achieving world domination.
173145,War for the Planet of the Apes,Action|Adventure|Drama|Sci-Fi,3450958,281338,2017,150000000.0,6316.0,7.1,488533726.0,140.0,42.56399999999999,"Caesar and his apes are forced into a deadly conflict with an army of humans led by a ruthless Colonel. After the apes suffer unimaginable losses, Caesar wrestles with his darker instincts and begins his own mythic quest to avenge his kind. As the journey finally brings them face to face, Caesar and the Colonel are pitted against each other in an epic battle that will determine the fate of both their species and the future of the planet."
173291,Valerian and the City of a Thousand Planets,Action|Adventure|Sci-Fi,2239822,339964,2017,177200000.0,5309.0,6.6,225874228.0,136.0,48.175,"In the 28th century, Valerian and Laureline are special operatives charged with keeping order throughout the human territories. On assignment from the Minister of Defense, the two undertake a mission to Alpha, an ever-expanding metropolis where species from across the universe have converged over centuries to share knowledge, intelligence, and cultures. At the center of Alpha is a mysterious dark force which threatens the peaceful existence of the City of a Thousand Planets, and Valerian and Laureline must race to identify the menace and safeguard not just Alpha, but the future of the universe."
173925,What Happened to Monday,Sci-Fi|Thriller,1536537,406990,2017,0.0,4370.0,7.2,27975429.0,123.0,34.23,"In a world where families are limited to one child due to overpopulation, a set of identical septuplets must avoid being put to a long sleep by the government and dangerous infighting while investigating the disappearance of one of their own."
173941,Atomic Blonde,Thriller,2406566,341013,2017,30000000.0,4616.0,6.4,100014025.0,115.0,47.43600000000001,An undercover MI6 agent is sent to Berlin during the Cold War to investigate the murder of a fellow agent and recover a missing list of double agents.
174055,Dunkirk,Action|Drama|Thriller|War,5013056,374720,2017,100000000.0,11770.0,7.4,525573161.0,107.0,33.052,"The story of the miraculous evacuation of Allied soldiers from Belgium, Britain, Canada and France, who were cut off and surrounded by the German army from the beaches and harbour of Dunkirk between May 26th and June 4th 1940 during World War II."
174585,Transformers: The Last Knight,Action|Adventure|Sci-Fi|Thriller,3371366,335988,2017,217000000.0,4114.0,6.0,605425157.0,149.0,46.464,"Autobots and Decepticons are at war, with humans on the sidelines. Optimus Prime is gone. The key to saving our future lies buried in the secrets of the past, in the hidden history of Transformers on Earth."
174909,Logan Lucky,Comedy,5439796,399170,2017,29000000.0,2268.0,6.7,48453605.0,119.0,22.910999999999998,"Trying to reverse a family curse, brothers Jimmy and Clyde Logan set out to execute an elaborate robbery during the legendary Coca-Cola 600 race at the Charlotte Motor Speedway."
175197,The Dark Tower,Fantasy|Horror|Sci-Fi|Western,1648190,353491,2017,60000000.0,3679.0,5.7,113231078.0,95.0,45.095,"The last Gunslinger, Roland Deschain, has been locked in an eternal battle with Walter O’Dim, also known as the Man in Black, determined to prevent him from toppling the Dark Tower, which holds the universe together. With the fate of the worlds at stake, good and evil will collide in the ultimate battle as only Roland can defend the Tower from the Man in Black."
175199,Annabelle: Creation,Horror,5140878,396422,2017,15000000.0,4011.0,6.5,306515884.0,109.0,47.131,"Several years after the tragic death of their little girl, a doll maker and his wife welcome a nun and several girls from a shuttered orphanage into their home, soon becoming the target of the doll maker's possessed creation—Annabelle."
175303,It,Horror,1396484,346364,2017,35000000.0,14182.0,7.2,701796444.0,135.0,64.916,"In a small town in Maine, seven children known as The Losers Club come face to face with life problems, bullies and a monster that takes the shape of a clown called Pennywise."
175475,The Emoji Movie,Animation|Children|Comedy,4877122,378236,2017,50000000.0,2123.0,5.6,216909830.0,86.0,71.611,"Gene, a multi-expressional emoji, sets out on a journey to become a normal emoji."
